{
  "$comment": "Design tokens shared by SwiftUI (InvoiceUI) and Compose (:core:designsystem). Colours are sRGB hex; sizes are points (iOS) = dp (Android). Text sizes are defaults before Dynamic Type / font scaling.",
  "version": 1,
  "color": {
    "light": {
      "brand": "#1A5FD6",
      "brandOn": "#FFFFFF",
      "background": "#F7F8FA",
      "surface": "#FFFFFF",
      "surfaceMuted": "#EEF1F5",
      "border": "#D8DEE6",
      "textPrimary": "#111827",
      "textSecondary": "#4B5563",
      "textTertiary": "#5B6371",
      "success": "#126B33",
      "warning": "#9A4A0B",
      "danger": "#B91C1C",
      "info": "#1D4ED8"
    },
    "dark": {
      "brand": "#4C8DFF",
      "brandOn": "#0B1220",
      "background": "#0B0F17",
      "surface": "#131A24",
      "surfaceMuted": "#1C2532",
      "border": "#2B3646",
      "textPrimary": "#F3F4F6",
      "textSecondary": "#C4CAD4",
      "textTertiary": "#9AA3AF",
      "success": "#4ADE80",
      "warning": "#FBBF24",
      "danger": "#F87171",
      "info": "#93C5FD"
    }
  },
  "status": {
    "$comment": "Chip colours for derived document status (ENGINE.md §6); pairs are [light, dark].",
    "draft": [
      "#6B7280",
      "#9AA3AF"
    ],
    "issued": [
      "#1D4ED8",
      "#93C5FD"
    ],
    "sent": [
      "#1D4ED8",
      "#93C5FD"
    ],
    "open": [
      "#1D4ED8",
      "#93C5FD"
    ],
    "partiallyPaid": [
      "#B45309",
      "#FBBF24"
    ],
    "overdue": [
      "#B91C1C",
      "#F87171"
    ],
    "paid": [
      "#15803D",
      "#4ADE80"
    ],
    "accepted": [
      "#15803D",
      "#4ADE80"
    ],
    "converted": [
      "#15803D",
      "#4ADE80"
    ],
    "declined": [
      "#6B7280",
      "#9AA3AF"
    ],
    "expired": [
      "#6B7280",
      "#9AA3AF"
    ],
    "void": [
      "#6B7280",
      "#9AA3AF"
    ]
  },
  "type": {
    "largeTitle": {
      "size": 34,
      "weight": "bold"
    },
    "title": {
      "size": 22,
      "weight": "semibold"
    },
    "headline": {
      "size": 17,
      "weight": "semibold"
    },
    "body": {
      "size": 17,
      "weight": "regular"
    },
    "callout": {
      "size": 16,
      "weight": "regular"
    },
    "subhead": {
      "size": 15,
      "weight": "regular"
    },
    "footnote": {
      "size": 13,
      "weight": "regular"
    },
    "caption": {
      "size": 12,
      "weight": "regular"
    },
    "amountLarge": {
      "size": 28,
      "weight": "semibold",
      "monospacedDigits": true
    },
    "amount": {
      "size": 17,
      "weight": "medium",
      "monospacedDigits": true
    }
  },
  "space": {
    "xxs": 2,
    "xs": 4,
    "s": 8,
    "m": 12,
    "l": 16,
    "xl": 24,
    "xxl": 32
  },
  "radius": {
    "s": 6,
    "m": 10,
    "l": 16,
    "pill": 999
  },
  "layout": {
    "minTouchTarget": 44,
    "maxReadableWidth": 720,
    "regularWidthBreakpoint": 600,
    "builderPreviewMinWidth": 900
  },
  "pdf": {
    "accentPresets": [
      "#1F6FEB",
      "#0F766E",
      "#7C3AED",
      "#B91C1C",
      "#C2410C",
      "#111827"
    ],
    "fontFamily": "Noto Sans",
    "fallbackFonts": [
      "Noto Sans Devanagari"
    ],
    "paper": {
      "A4": {
        "width": 595.28,
        "height": 841.89,
        "margin": 36
      },
      "Letter": {
        "width": 612,
        "height": 792,
        "margin": 36
      }
    },
    "$comment": "Static font files in spec/pdf/fonts (ADR-0006)."
  }
}
